{
    "name": "RPCS3",
    "consoles": ["ps3"],
    "gameExec": "--no-gui {}",
    "romQuery": ".*",
    "needsBios": true,
    "flags": {},
    "postInstall": {
        "makeLinks": {},
        "makeDirs": [],
        "makeFiles": []
    },
    "installOptions": {
        "flatpak": "net.rpcs3.RPCS3",
        "aur": "rpcs3-git",
        "aurExportName": "rpcs3",
        "gitRepo": "RPCS3/rpcs3-binaries-linux",
        "gitRe": "rpcs3-v.*-.*-.*_linux64.AppImage"
    },
    "$schema": "_schema.json"
}