{
    "name": "Cemu",
    "consoles": ["wiiu"],
    "gameExec": "-g {}",
    "needsBios": false,
    "flags": {},
    "romQuery": ".*(.wud|.WUD|.wux|.WUX|.wua|.WUA|.wuhb|.WUHB|.iso|.ISO|.rpx|.RPX|.elf|.ELF)",
    "postInstall": {
        "makeDirs": [],
        "makeFiles": [],
        "makeLinks": {}
    },
    "installOptions": {
        "flatpak": "info.cemu.Cemu",
        "aur": "cemu-git",
        "aurExportName": "Cemu",
        "gitRepo": "cemu-project/Cemu",
        "gitRe": "Cemu-.*-x86_64.AppImage"
    },
    "$schema": "_schema.json"
}
