{
    "name": "Dolphin Emulator",
    "consoles": ["gc", "wii"],
    "gameExec": "-b -e {}",
    "romQuery": ".*(.ciso|.CISO|.dol|.DOL|.elf|.ELF|.gcm|.GCM|.gcz|.GCZ|.iso|.ISO|.nkit.iso|.NKIT.ISO|.rvz|.RVZ|.wad|.WAD|.wia|.WIA)",
    "needsBios": false,
    "flags": {},
    "postInstall": {
        "makeLinks": {
            "<mods>/<id>/Load": "<config>/dolphin-emu/Load"
        },
        "makeDirs": [
            "<config>/dolphin-emu",
            "<save>/dolphin-emu/GC/USA",
            "<save>/dolphin-emu/GC/EUR",
            "<save>/dolphin-emu/GC/JPN",
            "<save>/dolphin-emu/GC/JAP",
            "<save>/dolphin-emu/Wii"
        ],
        "makeFiles": [{
            "path": "<config>/dolphin-emu/Dolphin.ini",
            "content": {
                "Core": {
                    "GCIFolderAPath": "<save>/dolphin-emu/GC"
                },
                "General": {
                    "NANDRootPath": "<save>/dolphin-emu/Wii"
                }
            }
        }]
    },
    "installOptions": {
        "flatpak": "org.DolphinEmu.dolphin-emu",
        "aur": "dolphin-emu-git",
        "aurExportName": "dolphin-emu",
        "libretroCore": "dolphin",
        "gitRepo": "pkgforge-dev/Dolphin-emu-AppImage",
        "gitRe": "Dolphin_Emulator-.*-anylinux.squashfs-x86_64.AppImage"
    },
    "$schema": "_schema.json"
}