{
    "name": "Ryujinx (Ryubing)",
    "consoles": ["switch"],
    "gameExec": "{}",
    "romQuery": ".*(.kip|.KIP|.nca|.NCA|.nro|.NRO|.nso|.NSO|.nsp|.NSP|.xci|.XCI)",
    "needsBios": true,
    "flags": {},
    "postInstall": {
        "makeLinks": {},
        "makeDirs": [],
        "makeFiles": []
    },
    "installOptions": {
        "flatpak": "io.github.ryubing.Ryujinx",
        "aur": "ryujinx-git",
        "aurExportName": "ryujinx",
        "gitRepo": "ryubing/ryujinx",
        "gitRe": "ryujinx-*.-x64.AppImage"
    },
    "$schema": "./_schema.json"
}
