{
    "name": "Ryujinx (Legacy)",
    "consoles": ["switch"],
    "gameExec": "{}",
    "romQuery": ".*",
    "needsBios": true,
    "flags": {},
    "postInstall": {
        "makeLinks": {},
        "makeDirs": [],
        "makeFiles": []
    },
    "installOptions": {
        "flatpak": "org.ryujinx.Ryujinx",
        "manual": true
    },
    "$schema": "_schema.json"
}