{
    "name": "PPSSPP",
    "consoles": ["psp"],
    "gameExec": "{fullscreen} {}",
    "romQuery": ".*",
    "needsBios": false,
    "flags": {
        "fullscreen": "-f"
    },
    "postInstall": {
        "makeLinks": {},
        "makeDirs": [],
        "makeFiles": []
    },
    "installOptions": {
        "flatpak": "org.ppsspp.PPSSPP",
        "aur": "ppsspp-git",
        "aurExportName": "PPSSPPSDL",
        "libretroCore": "ppsspp",
        "gitRepo": "pkgforge-dev/PPSSPP-AppImage",
        "gitRe": "ppsspp-.*-anylinux-x86_64.AppImage"
    },
    "$schema": "_schema.json"
}