{
    "name": "MelonDS",
    "consoles": ["nds"],
    "gameExec": "{fullscreen} {}",
    "romQuery": ".*(.7z|.7Z|.nds|.NDS|.zip|.ZIP)",
    "needsBios": false,
    "flags": {
        "fullscreen": "-f"
    },
    "postInstall": {
        "makeLinks": {
            
        },
        "makeDirs": [
            "<config>/melonDS",
            "<save>/melonds/saves",
            "<save>/melonds/states"
        ],
        
        "makeFiles": [{
            "path": "<config>/melonDS/melonDS.toml",
            "content": {
                "Instance0": {
                    "SaveFilePath": "\"<save>/melonds/saves\"",
                    "SavestatePath": "\"<save>/melonds/saves\""
                }
            }
        }]
    },
    "installOptions": {
        "flatpak": "net.kuribo64.melonDS",
        "aur": "melonds-git",
        "aurExportName": "melonDS",
        "gitRepo": "melonds-emu/melonds",
        "gitRe": "melonDS-appimage-x86_64.zip",
        "unzipTarget": "melonDS-x86_64.AppImage",
        "libretroCore": "melonds"
    },
    "$schema": "_schema.json" 
}